{"$schema":"https://json-schema.org/draft/2020-12/schema","$id":"https://pulse.sharebravery.dev/schemas/x-content/v1","type":"object","properties":{"schemaVersion":{"type":"string","const":"x-content/v1"},"contentId":{"type":"string","pattern":"^[a-z0-9][a-z0-9-]{7,127}$"},"generatedAt":{"type":"string","format":"date-time","pattern":"^(?:(?:\\d\\d[2468][048]|\\d\\d[13579][26]|\\d\\d0[48]|[02468][048]00|[13579][26]00)-02-29|\\d{4}-(?:(?:0[13578]|1[02])-(?:0[1-9]|[12]\\d|3[01])|(?:0[469]|11)-(?:0[1-9]|[12]\\d|30)|(?:02)-(?:0[1-9]|1\\d|2[0-8])))T(?:(?:[01]\\d|2[0-3]):[0-5]\\d(?::[0-5]\\d(?:\\.\\d+)?)?(?:Z|([+-](?:[01]\\d|2[0-3]):[0-5]\\d)))$"},"displayTitle":{"type":"string","minLength":1,"maxLength":100},"operator":{"type":"object","properties":{"name":{"type":"string","const":"pulse-x"},"repository":{"type":"string","pattern":"^[A-Za-z0-9_.-]+\\/[A-Za-z0-9_.-]+$"},"commitSha":{"type":"string","pattern":"^[0-9a-fA-F]{40}$"}},"required":["name","repository","commitSha"],"additionalProperties":false},"event":{"type":"object","properties":{"title":{"type":"string","minLength":1,"maxLength":180},"whyItMatters":{"type":"string","minLength":1,"maxLength":500},"domains":{"minItems":1,"maxItems":3,"type":"array","items":{"type":"string","minLength":1,"maxLength":80}}},"required":["title","whyItMatters","domains"],"additionalProperties":false},"sources":{"minItems":1,"maxItems":12,"type":"array","items":{"type":"object","properties":{"sourceId":{"type":"string","pattern":"^[A-Za-z0-9][A-Za-z0-9_-]{0,63}$"},"title":{"type":"string","minLength":1,"maxLength":300},"url":{"type":"string","format":"uri"},"publishedAt":{"type":"string","format":"date-time","pattern":"^(?:(?:\\d\\d[2468][048]|\\d\\d[13579][26]|\\d\\d0[48]|[02468][048]00|[13579][26]00)-02-29|\\d{4}-(?:(?:0[13578]|1[02])-(?:0[1-9]|[12]\\d|3[01])|(?:0[469]|11)-(?:0[1-9]|[12]\\d|30)|(?:02)-(?:0[1-9]|1\\d|2[0-8])))T(?:(?:[01]\\d|2[0-3]):[0-5]\\d(?::[0-5]\\d(?:\\.\\d+)?)?(?:Z|([+-](?:[01]\\d|2[0-3]):[0-5]\\d)))$"},"kind":{"type":"string","enum":["official","filing","regulator","paper","incident_report","reporting","other"]}},"required":["sourceId","title","url"],"additionalProperties":false}},"images":{"maxItems":2,"type":"array","items":{"type":"object","properties":{"imageId":{"type":"string","pattern":"^[A-Za-z0-9][A-Za-z0-9_-]{0,63}$"},"url":{"type":"string","format":"uri"},"sourcePageUrl":{"type":"string","format":"uri"},"alt":{"type":"string","minLength":1,"maxLength":500},"caption":{"type":"string","maxLength":500},"sourceName":{"type":"string","minLength":1,"maxLength":120},"usage":{"type":"string","enum":["primary","supporting"]}},"required":["imageId","url","sourcePageUrl","alt","sourceName","usage"],"additionalProperties":false}},"candidates":{"minItems":1,"maxItems":3,"type":"array","items":{"oneOf":[{"type":"object","properties":{"candidateId":{"type":"string","pattern":"^[A-Za-z0-9][A-Za-z0-9_-]{0,63}$"},"label":{"type":"string","minLength":1,"maxLength":80},"angle":{"type":"string","minLength":1,"maxLength":120},"translation":{"type":"string","minLength":1,"maxLength":8000},"sourceIds":{"minItems":1,"type":"array","items":{"type":"string","pattern":"^[A-Za-z0-9][A-Za-z0-9_-]{0,63}$"}},"imageIds":{"maxItems":2,"type":"array","items":{"type":"string","pattern":"^[A-Za-z0-9][A-Za-z0-9_-]{0,63}$"}},"kind":{"type":"string","const":"post"},"text":{"type":"string","minLength":1,"maxLength":280}},"required":["candidateId","label","angle","translation","sourceIds","imageIds","kind","text"],"additionalProperties":false},{"type":"object","properties":{"candidateId":{"type":"string","pattern":"^[A-Za-z0-9][A-Za-z0-9_-]{0,63}$"},"label":{"type":"string","minLength":1,"maxLength":80},"angle":{"type":"string","minLength":1,"maxLength":120},"translation":{"type":"string","minLength":1,"maxLength":8000},"sourceIds":{"minItems":1,"type":"array","items":{"type":"string","pattern":"^[A-Za-z0-9][A-Za-z0-9_-]{0,63}$"}},"imageIds":{"maxItems":2,"type":"array","items":{"type":"string","pattern":"^[A-Za-z0-9][A-Za-z0-9_-]{0,63}$"}},"kind":{"type":"string","const":"reply"},"text":{"type":"string","minLength":1,"maxLength":280},"target":{"type":"object","properties":{"url":{"type":"string","format":"uri"},"author":{"type":"string","minLength":1,"maxLength":100},"publishedAt":{"type":"string","format":"date-time","pattern":"^(?:(?:\\d\\d[2468][048]|\\d\\d[13579][26]|\\d\\d0[48]|[02468][048]00|[13579][26]00)-02-29|\\d{4}-(?:(?:0[13578]|1[02])-(?:0[1-9]|[12]\\d|3[01])|(?:0[469]|11)-(?:0[1-9]|[12]\\d|30)|(?:02)-(?:0[1-9]|1\\d|2[0-8])))T(?:(?:[01]\\d|2[0-3]):[0-5]\\d(?::[0-5]\\d(?:\\.\\d+)?)?(?:Z|([+-](?:[01]\\d|2[0-3]):[0-5]\\d)))$"}},"required":["url","author","publishedAt"],"additionalProperties":false}},"required":["candidateId","label","angle","translation","sourceIds","imageIds","kind","text","target"],"additionalProperties":false},{"type":"object","properties":{"candidateId":{"type":"string","pattern":"^[A-Za-z0-9][A-Za-z0-9_-]{0,63}$"},"label":{"type":"string","minLength":1,"maxLength":80},"angle":{"type":"string","minLength":1,"maxLength":120},"translation":{"type":"string","minLength":1,"maxLength":8000},"sourceIds":{"minItems":1,"type":"array","items":{"type":"string","pattern":"^[A-Za-z0-9][A-Za-z0-9_-]{0,63}$"}},"imageIds":{"maxItems":2,"type":"array","items":{"type":"string","pattern":"^[A-Za-z0-9][A-Za-z0-9_-]{0,63}$"}},"kind":{"type":"string","const":"quote"},"text":{"type":"string","minLength":1,"maxLength":280},"target":{"type":"object","properties":{"url":{"type":"string","format":"uri"},"author":{"type":"string","minLength":1,"maxLength":100},"publishedAt":{"type":"string","format":"date-time","pattern":"^(?:(?:\\d\\d[2468][048]|\\d\\d[13579][26]|\\d\\d0[48]|[02468][048]00|[13579][26]00)-02-29|\\d{4}-(?:(?:0[13578]|1[02])-(?:0[1-9]|[12]\\d|3[01])|(?:0[469]|11)-(?:0[1-9]|[12]\\d|30)|(?:02)-(?:0[1-9]|1\\d|2[0-8])))T(?:(?:[01]\\d|2[0-3]):[0-5]\\d(?::[0-5]\\d(?:\\.\\d+)?)?(?:Z|([+-](?:[01]\\d|2[0-3]):[0-5]\\d)))$"}},"required":["url","author","publishedAt"],"additionalProperties":false}},"required":["candidateId","label","angle","translation","sourceIds","imageIds","kind","text","target"],"additionalProperties":false},{"type":"object","properties":{"candidateId":{"type":"string","pattern":"^[A-Za-z0-9][A-Za-z0-9_-]{0,63}$"},"label":{"type":"string","minLength":1,"maxLength":80},"angle":{"type":"string","minLength":1,"maxLength":120},"translation":{"type":"string","minLength":1,"maxLength":8000},"sourceIds":{"minItems":1,"type":"array","items":{"type":"string","pattern":"^[A-Za-z0-9][A-Za-z0-9_-]{0,63}$"}},"imageIds":{"maxItems":2,"type":"array","items":{"type":"string","pattern":"^[A-Za-z0-9][A-Za-z0-9_-]{0,63}$"}},"kind":{"type":"string","const":"thread"},"posts":{"minItems":2,"maxItems":20,"type":"array","items":{"type":"string","minLength":1,"maxLength":280}}},"required":["candidateId","label","angle","translation","sourceIds","imageIds","kind","posts"],"additionalProperties":false}]}},"recommendation":{"type":"object","properties":{"candidateId":{"type":"string","pattern":"^[A-Za-z0-9][A-Za-z0-9_-]{0,63}$"},"reason":{"type":"string","minLength":1,"maxLength":500}},"required":["candidateId","reason"],"additionalProperties":false}},"required":["schemaVersion","contentId","generatedAt","displayTitle","operator","event","sources","images","candidates"],"additionalProperties":false,"title":"Pulse X Content v1"}