{
  "schemaVersion": "x-content/v1",
  "contentId": "x-20260723-example-post",
  "generatedAt": "2026-07-23T09:00:00+08:00",
  "displayTitle": "Example launch changes a developer workflow",
  "operator": {
    "name": "pulse-x",
    "repository": "sharebravery/pulse-x",
    "commitSha": "aaaaaaaaaaaaaaaaaaaaaaaaaaaaaaaaaaaaaaaa"
  },
  "event": {
    "title": "Example product launch",
    "whyItMatters": "The release materially changes a common developer workflow.",
    "domains": ["AI and software"]
  },
  "sources": [
    {
      "sourceId": "official",
      "title": "Official announcement",
      "url": "https://example.com/announcement",
      "publishedAt": "2026-07-23T00:30:00Z",
      "kind": "official"
    }
  ],
  "images": [],
  "candidates": [
    {
      "candidateId": "c1",
      "kind": "post",
      "label": "Direct take",
      "angle": "Developer impact",
      "translation": "一条基于官方公告、突出开发者影响的简洁示例帖子。",
      "sourceIds": ["official"],
      "imageIds": [],
      "text": "A concise example post grounded in the official announcement."
    }
  ]
}
